{
  "name": "intl-education",
  "note": "夜课海报：纸是暖象牙，主色是孔雀蓝，强调是芥末油墨。深色带用暖墨，不用蓝紫，也不用红。照片略压暗，阴影仍是暖墨。",
  "color": {
    "bg": "#FCF6E0",
    "surface": "#FFFFFF",
    "text": "#1C1418",
    "text-muted": "#5E4A50",
    "border": "#E6DEE1",
    "primary": "#087A91",
    "primary-contrast": "#FFFFFF",
    "accent": "#6B5E00",
    "on-media": "#FFFFFF"
  },
  "font": {
    "font-heading": "\"Segoe UI\", \"PingFang SC\", \"Noto Sans SC\", sans-serif",
    "font-body": "\"Segoe UI\", \"PingFang SC\", \"Noto Sans SC\", sans-serif"
  },
  "type": {
    "base": 16,
    "ratio": 1.333,
    "hero": 88,
    "display": "sans"
  },
  "radius": {
    "radius-sm": "2px",
    "radius-md": "6px",
    "radius-lg": "10px"
  },
  "shadow": {
    "shadow-card": "0 12px 28px rgb(28 20 24 / 0.10)"
  },
  "density": "standard",
  "sectionY": "128px",
  "container": 1200,
  "motion": 1
}
