{
  "name": "cn-wedding-photo",
  "note": "纱是藕粉，不是正红。底是带一点粉的暖白，主色是压暗的豆沙玫瑰，用在店名、按钮和数字上。价格用更深的梅紫，比豆沙更暗，暖白上能读清。深色块用梅褐，不铺金，也不铺正红。",
  "color": {
    "bg": "#F6F1EE",
    "surface": "#FBF7F5",
    "text": "#2C2226",
    "text-muted": "#5E484E",
    "border": "#E6D5D0",
    "primary": "#9A5370",
    "primary-contrast": "#FFF8F6",
    "accent": "#684C62",
    "on-media": "#FFF8F6"
  },
  "font": {
    "font-heading": "\"Noto Serif SC\", \"Songti SC\", \"SimSun\", serif",
    "font-body": "\"Segoe UI\", \"PingFang SC\", \"Noto Sans SC\", sans-serif"
  },
  "type": {
    "base": 16,
    "ratio": 1.25,
    "hero": 76,
    "display": "serif"
  },
  "radius": {
    "radius-sm": "2px",
    "radius-md": "4px",
    "radius-lg": "8px"
  },
  "shadow": {
    "shadow-card": "0 12px 28px rgb(44 34 38 / 0.12)"
  },
  "density": "standard",
  "sectionY": "80px",
  "container": 1200,
  "motion": 1
}
