{
  "name": "cn-hospitality",
  "note": "午后的院墙。主色是压暗的苔绿，比稻黄更绿，也比松绿更暗，只铺按钮、热线和当前项。纸是暖沙，字是墨。价格用一小块暖褐，大面积不铺褐，也不铺正绿。",
  "color": {
    "bg": "#F3EDE0",
    "surface": "#FBF7F0",
    "text": "#2C291F",
    "text-muted": "#5A5548",
    "border": "#E3D6C4",
    "primary": "#092B08",
    "primary-contrast": "#F7F3EA",
    "accent": "#564639",
    "on-media": "#F7F3EA"
  },
  "font": {
    "font-heading": "\"Noto Serif SC\", \"Source Han Serif SC\", \"Songti SC\", \"STSong\", \"SimSun\", serif",
    "font-body": "\"Segoe UI\", \"PingFang SC\", \"Noto Sans SC\", \"Source Han Sans SC\", sans-serif"
  },
  "type": {
    "base": 16,
    "ratio": 1.25,
    "hero": 72,
    "display": "serif"
  },
  "radius": {
    "radius-sm": "2px",
    "radius-md": "4px",
    "radius-lg": "8px"
  },
  "shadow": {
    "shadow-card": "0 12px 28px rgb(44 41 31 / 0.08)"
  },
  "density": "standard",
  "sectionY": "80px",
  "container": 1200,
  "motion": 1
}
