{
  "name": "cn-factory",
  "note": "色彩故事：车间是冷静的钢蓝灰。主色是沉下去的工业深蓝，只铺数字带和主按钮，不是亮蓝招牌。强调是亮一档的安全黄铜，用在热线数字、短线和主按钮悬停。底是发冷的钢板灰，字是带钢蓝的墨。不铺橙。",
  "color": {
    "bg": "#eef2f5",
    "surface": "#f4f7f9",
    "text": "#152230",
    "text-muted": "#3c4e5c",
    "border": "#c5ced6",
    "primary": "#1f4f82",
    "primary-contrast": "#f4f7f9",
    "accent": "#866410",
    "on-media": "#f4f7f9"
  },
  "font": {
    "font-heading": "\"Segoe UI\", \"PingFang SC\", \"Noto Sans SC\", \"Microsoft YaHei\", sans-serif",
    "font-body": "\"Segoe UI\", \"PingFang SC\", \"Noto Sans SC\", \"Microsoft YaHei\", sans-serif"
  },
  "type": {
    "base": 16,
    "ratio": 1.25,
    "hero": 76,
    "display": "sans"
  },
  "radius": {
    "radius-sm": "0px",
    "radius-md": "2px",
    "radius-lg": "2px"
  },
  "shadow": {
    "shadow-card": "none"
  },
  "density": "standard",
  "sectionY": "80px",
  "container": 1200,
  "motion": 1
}
