{
  "name": "__ID__",
  "note": "脚手架配色，不是正式样板间。换成自己的颜色后再跑原创性检查。",
  "color": {
    "bg": "#f3f5f4",
    "surface": "#fbfcfb",
    "text": "#1c211e",
    "text-muted": "#3e4642",
    "border": "#d5dad6",
    "primary": "#1f4d3a",
    "primary-contrast": "#f3f6f4",
    "accent": "#6b4518",
    "on-media": "#f4f7f5"
  },
  "font": {
    "font-heading": "\"Segoe UI\", \"PingFang SC\", \"Microsoft YaHei\", \"Noto Sans SC\", sans-serif",
    "font-body": "\"Segoe UI\", \"PingFang SC\", \"Microsoft YaHei\", \"Noto Sans SC\", sans-serif"
  },
  "type": {
    "base": 17,
    "ratio": 1.25,
    "hero": 72,
    "display": "sans"
  },
  "radius": {
    "radius-sm": "2px",
    "radius-md": "4px",
    "radius-lg": "8px"
  },
  "shadow": { "shadow-card": "none" },
  "density": "standard",
  "sectionY": "96px",
  "container": 1200,
  "motion": 1
}
