{
  "name": "_smoke",
  "note": "不是正式样板间的配色。沿用中性色，标题用衬线，用来验收美业衬线、96px 标题和 140px 留白。",
  "color": {
    "bg": "#f3f5f4",
    "surface": "#fbfcfb",
    "text": "#1c211e",
    "text-muted": "#3e4642",
    "border": "#d5dad6",
    "primary": "#1f4d3a",
    "primary-contrast": "#f3f6f4",
    "accent": "#6b4518",
    "on-media": "#f4f7f5"
  },
  "font": {
    "font-heading": "\"Songti SC\", \"Noto Serif SC\", serif",
    "font-body": "\"Segoe UI\", \"PingFang SC\", \"Microsoft YaHei\", \"Noto Sans SC\", sans-serif"
  },
  "type": {
    "base": 17,
    "ratio": 1.25,
    "hero": 96,
    "display": "serif"
  },
  "radius": {
    "radius-sm": "2px",
    "radius-md": "4px",
    "radius-lg": "8px"
  },
  "shadow": {
    "shadow-card": "none"
  },
  "density": "standard",
  "sectionY": "140px",
  "container": 1200,
  "motion": 1
}
