{
  "name": "cn-dining",
  "note": "焙火把乌龙烤到深茶色，不是鲜橙也不是朱红。桌子是旧米色亚麻，字是深咖，强调只用一小块松烟绿标价格和分类，大面积不铺绿。",
  "color": {
    "bg": "#F4EFE8",
    "surface": "#FBF8F4",
    "text": "#2E241C",
    "text-muted": "#5C463A",
    "border": "#E3D5C8",
    "primary": "#6B2F14",
    "primary-contrast": "#FFF7F0",
    "accent": "#234C3A",
    "on-media": "#FBF7F2"
  },
  "font": {
    "font-heading": "\"Noto Serif SC\", \"Songti SC\", \"SimSun\", serif",
    "font-body": "\"Segoe UI\", \"PingFang SC\", \"Noto Sans SC\", sans-serif"
  },
  "type": {
    "base": 16,
    "ratio": 1.25,
    "hero": 72,
    "display": "serif"
  },
  "radius": {
    "radius-sm": "2px",
    "radius-md": "4px",
    "radius-lg": "8px"
  },
  "shadow": {
    "shadow-card": "0 12px 28px rgb(46 36 28 / 0.12)"
  },
  "density": "standard",
  "sectionY": "80px",
  "container": 1200,
  "motion": 1
}
