{
  "name": "cn-medical",
  "note": "诊室灯是冷白。主色是一支偏蓝的医疗青，明亮，用在按钮、热线和标题下划线。它比松绿更蓝，比车间深蓝更亮，也不是薄荷绿。强调是暗橄榄，只标价格和步骤号。不用靛，靛和家装的深蓝、主参考的海军蓝太近。纸几乎不带彩，字是带一点青的墨。",
  "color": {
    "bg": "#F3F6F6",
    "surface": "#FBFCFC",
    "text": "#1A2428",
    "text-muted": "#3A4648",
    "border": "#D3D9D9",
    "primary": "#0A7A86",
    "primary-contrast": "#F7F8F8",
    "accent": "#494912",
    "on-media": "#F7F8F8"
  },
  "font": {
    "font-heading": "\"Segoe UI\", \"PingFang SC\", \"Noto Sans SC\", sans-serif",
    "font-body": "\"Segoe UI\", \"PingFang SC\", \"Noto Sans SC\", sans-serif"
  },
  "type": {
    "base": 16,
    "ratio": 1.25,
    "hero": 80,
    "display": "sans"
  },
  "radius": {
    "radius-sm": "2px",
    "radius-md": "4px",
    "radius-lg": "8px"
  },
  "shadow": {
    "shadow-card": "none"
  },
  "density": "standard",
  "sectionY": "80px",
  "container": 1200,
  "motion": 1
}
