{
  "name": "cn-education",
  "note": "白天的实训车间：松绿是工装和合格章，明橙是课表重点和学费，纸是浅松绿，深色带用松黑。照片明亮、自然光、偏暖。不靠教室蓝，也不靠紫。",
  "color": {
    "bg": "#DCECE1",
    "surface": "#F7F8F7",
    "text": "#17241C",
    "text-muted": "#3E4A44",
    "border": "#D5D9D6",
    "primary": "#0B6B40",
    "primary-contrast": "#F4F6F5",
    "accent": "#BB3600",
    "on-media": "#F4F6F5"
  },
  "font": {
    "font-heading": "\"Segoe UI\", \"PingFang SC\", \"Noto Sans SC\", sans-serif",
    "font-body": "\"Segoe UI\", \"PingFang SC\", \"Noto Sans SC\", sans-serif"
  },
  "type": {
    "base": 16,
    "ratio": 1.25,
    "hero": 76,
    "display": "sans"
  },
  "radius": {
    "radius-sm": "2px",
    "radius-md": "6px",
    "radius-lg": "14px"
  },
  "shadow": {
    "shadow-card": "0 10px 28px rgb(23 36 28 / 0.08)"
  },
  "density": "standard",
  "sectionY": "80px",
  "container": 1200,
  "motion": 1
}
