{
  "name": "intl-professional",
  "note": "暖灰石纸上的深墨绿。强调是干了的青铜褐，只用在小标和年份上。",
  "color": {
    "bg": "#E8DCC8",
    "surface": "#F6F1E6",
    "text": "#1C2B27",
    "text-muted": "#3C4E47",
    "border": "#D5C7B4",
    "primary": "#1A4036",
    "primary-contrast": "#F6F1E6",
    "accent": "#7A4A16",
    "on-media": "#F6F1E6"
  },
  "font": {
    "font-heading": "\"Source Han Serif SC\", \"Noto Serif SC\", \"Songti SC\", STSong, serif",
    "font-body": "\"Segoe UI\", \"PingFang SC\", \"Noto Sans SC\", \"Microsoft YaHei\", sans-serif"
  },
  "type": {
    "base": 17,
    "ratio": 1.333,
    "hero": 88,
    "display": "serif"
  },
  "radius": {
    "radius-sm": "2px",
    "radius-md": "2px",
    "radius-lg": "4px"
  },
  "shadow": {
    "shadow-card": "0 16px 40px rgb(26 64 54 / 0.08)"
  },
  "density": "standard",
  "sectionY": "clamp(3rem, 10vw, 140px)",
  "container": 1200,
  "motion": 1
}
