{
  "name": "cn-agriculture",
  "note": "色彩故事：纸是晒过的米白。主色是压暗的稻穗黄，只铺主按钮、标题短线和价格，不铺成整屏金。强调是深一点的红土，用在热线数字和主按钮悬停。字是干土墨。不铺松绿，也不用黄铜。",
  "color": {
    "bg": "#F6F1E4",
    "surface": "#FBF6EC",
    "text": "#241E16",
    "text-muted": "#514536",
    "border": "#DDD2C2",
    "primary": "#5C4E00",
    "primary-contrast": "#FFF9F0",
    "accent": "#280600",
    "on-media": "#FFF9F0"
  },
  "font": {
    "font-heading": "\"Segoe UI\", \"PingFang SC\", \"Noto Sans SC\", \"Source Han Sans SC\", sans-serif",
    "font-body": "\"Segoe UI\", \"PingFang SC\", \"Noto Sans SC\", \"Source Han Sans SC\", sans-serif"
  },
  "type": {
    "base": 16,
    "ratio": 1.25,
    "hero": 72,
    "display": "sans"
  },
  "radius": {
    "radius-sm": "2px",
    "radius-md": "4px",
    "radius-lg": "6px"
  },
  "shadow": {
    "shadow-card": "0 10px 28px rgb(36 30 22 / 0.08)"
  },
  "density": "standard",
  "sectionY": "96px",
  "container": 1200,
  "motion": 1
}
