{
  "name": "cn-auto",
  "note": "车间地坪是冷灰，车漆是正红。红比深茶更亮、更纯，只铺按钮、当前导航和工单顶上那一条。价格用车间绿，不用蓝。大面积不铺红，也不铺绿。字是带一点钢色的深炭灰。",
  "color": {
    "bg": "#F2F4F6",
    "surface": "#F8F9FA",
    "text": "#1A222B",
    "text-muted": "#3D4B59",
    "border": "#D3DAE1",
    "primary": "#C8042C",
    "primary-contrast": "#FFFFFF",
    "accent": "#106D14",
    "on-media": "#F4F6F8"
  },
  "font": {
    "font-heading": "\"Segoe UI\", \"PingFang SC\", \"Noto Sans SC\", sans-serif",
    "font-body": "\"Segoe UI\", \"PingFang SC\", \"Noto Sans SC\", sans-serif"
  },
  "type": {
    "base": 16,
    "ratio": 1.25,
    "hero": 72,
    "display": "sans"
  },
  "radius": {
    "radius-sm": "2px",
    "radius-md": "2px",
    "radius-lg": "2px"
  },
  "shadow": {
    "shadow-card": "0 10px 24px rgb(26 34 43 / 0.12)"
  },
  "density": "standard",
  "sectionY": "80px",
  "container": 1180,
  "motion": 1
}
