{
  "name": "cn-home-decor",
  "note": "色彩故事：展厅是暖白纸和浅橡木。主色是明亮暖橙，只铺主按钮和那一条数字带，比深茶更亮、更饱和。强调色是深湖蓝，用在报价、热线和套餐价。深色板块用墨色，不铺整块橙。图上的字是白。",
  "color": {
    "bg": "#FBF6EE",
    "surface": "#FFFFFF",
    "text": "#2C1810",
    "text-muted": "#6A5040",
    "border": "#E6D3C2",
    "primary": "#AE5C00",
    "primary-contrast": "#FFFFFF",
    "accent": "#1A365D",
    "on-media": "#FFFFFF"
  },
  "font": {
    "font-heading": "\"Segoe UI\", \"PingFang SC\", \"Noto Sans SC\", \"Source Han Sans SC\", sans-serif",
    "font-body": "\"Segoe UI\", \"PingFang SC\", \"Noto Sans SC\", \"Source Han Sans SC\", sans-serif"
  },
  "type": {
    "base": 16,
    "ratio": 1.25,
    "hero": 72,
    "display": "sans"
  },
  "radius": {
    "radius-sm": "0px",
    "radius-md": "2px",
    "radius-lg": "2px"
  },
  "shadow": {
    "shadow-card": "none"
  },
  "density": "standard",
  "sectionY": "88px",
  "container": 1180,
  "motion": 1
}
