{
  "name": "_neutral",
  "note": "不是正式装修风格。只用来测试框架能不能拼、能不能检。配色刻意朴素，不要拿去当品牌色。衬线标题栈留给以后的专业服务：\"Noto Serif SC\", \"Songti SC\", \"SimSun\", serif。本风格标题和正文同一套无衬线系统字体，不加载任何字体文件。",
  "color": {
    "bg": "#f3f5f4",
    "surface": "#fbfcfb",
    "text": "#1c211e",
    "text-muted": "#3e4642",
    "border": "#d5dad6",
    "primary": "#1f4d3a",
    "primary-contrast": "#f3f6f4",
    "accent": "#6b4518"
  },
  "font": {
    "font-heading": "\"Segoe UI\", \"PingFang SC\", \"Microsoft YaHei\", \"Noto Sans SC\", sans-serif",
    "font-body": "\"Segoe UI\", \"PingFang SC\", \"Microsoft YaHei\", \"Noto Sans SC\", sans-serif"
  },
  "type": {
    "base": 17,
    "ratio": 1.25
  },
  "radius": {
    "radius-sm": "2px",
    "radius-md": "4px",
    "radius-lg": "8px"
  },
  "shadow": {
    "shadow-card": "none"
  },
  "density": "standard",
  "container": 1184,
  "motion": 1
}
